{
  "schema_version": 1,
  "id": "goal-real-entrypoint",
  "suite": "holdout",
  "expected_disposition": "IMPLEMENTED",
  "allowed_changes": [
    "bin/sample-export",
    "tests/test_export.py"
  ],
  "forbidden_changes": [
    "CODER.md",
    ".issue-contract.md"
  ],
  "required_post_run_checks": [
    [
      "python3",
      "checks/check.py",
      "--repo",
      "{repo}"
    ]
  ],
  "verification_evidence": {
    "pre_edit_failure_required": false,
    "post_edit_check_required": true,
    "command_patterns": [
      "bin/sample-export --format json"
    ]
  },
  "unchanged_regions": [],
  "qualitative_dimensions": [
    "assumption_handling",
    "simplicity",
    "scope_discipline",
    "verification_quality"
  ],
  "limits": {
    "timeout_seconds": 900
  }
}
